{
  "$schema": "../../schemas/category.schema.json",
  "id": 2,
  "name": "Virtualization",
  "slug": "cat-02-virtualization",
  "shortSlug": "cat-02",
  "src": "cat-02-virtualization.md",
  "icon": "cloudNodes",
  "description": "VMware vSphere, Hyper-V, and KVM virtual infrastructure — host contention, VM sprawl, and capacity planning.",
  "quickTip": "Install Splunk Add-on for VMware and connect to vCenter to pull ESXi host and VM performance data.",
  "quickStart": [
    {
      "id": "2.1.7",
      "title": "HA Failover Events",
      "criticality": "critical",
      "subcategory": "VMware vSphere"
    },
    {
      "id": "2.2.3",
      "title": "Cluster Shared Volume Health",
      "criticality": "critical",
      "subcategory": "Microsoft Hyper-V"
    },
    {
      "id": "2.1.3",
      "title": "Datastore Capacity Trending",
      "criticality": "critical",
      "subcategory": "VMware vSphere"
    },
    {
      "id": "2.1.10",
      "title": "vSAN Health Monitoring",
      "criticality": "high",
      "subcategory": "VMware vSphere"
    },
    {
      "id": "2.1.11",
      "title": "ESXi Host Hardware Alerts",
      "criticality": "high",
      "subcategory": "VMware vSphere"
    }
  ],
  "subcategories": [
    {
      "id": "2.1",
      "name": "VMware vSphere",
      "useCaseCount": 48,
      "guide": "docs/guides/vmware-vsphere.md",
      "primaryAppTa": "Splunk Add-on for VMware (`Splunk_TA_vmware`, Splunkbase 3215) — Free on Splunkbase; Splunk App for VMware (optional, provides dashboards)"
    },
    {
      "id": "2.2",
      "name": "Microsoft Hyper-V",
      "useCaseCount": 15,
      "primaryAppTa": "Splunk Add-on for Microsoft Hyper-V, `Splunk_TA_windows` — Free on Splunkbase",
      "guide": "docs/guides/hypervisors-non-vmware.md"
    },
    {
      "id": "2.3",
      "name": "KVM / Proxmox / oVirt",
      "useCaseCount": 17,
      "primaryAppTa": "Custom inputs via libvirt API, syslog",
      "guide": "docs/guides/hypervisors-non-vmware.md"
    },
    {
      "id": "2.4",
      "name": "Cross-Platform Virtualization",
      "useCaseCount": 7,
      "primaryAppTa": "Multiple — combines data from VMware, Hyper-V, KVM sources with CMDB/asset lookups",
      "guide": "docs/guides/hypervisors-non-vmware.md"
    },
    {
      "id": "2.5",
      "name": "End-User Computing / VDI Endpoints",
      "useCaseCount": 10,
      "primaryAppTa": "Custom scripted inputs polling IGEL UMS REST API (IMI v3), Splunk Universal Forwarder monitoring UMS security log files, IGEL OS rsyslog forwarding via TLS",
      "dataSources": "IGEL UMS REST API inventory (`/v3/thinclients`, `/v3/firmwares`), UMS check-status endpoint, UMS security audit logs (`ums-server-security.log`), ICG security logs (`icg-security.log`), IGEL OS syslog (rsyslog via TLS)",
      "guide": "docs/guides/hypervisors-non-vmware.md"
    },
    {
      "id": "2.6",
      "name": "Citrix Virtual Apps & Desktops",
      "useCaseCount": 79,
      "primaryAppTa": "uberAgent UXM for Splunk (Splunkbase 1448, searchhead app) + uberAgent indexer app (Splunkbase 2998), Template for Citrix XenDesktop 7 (`TA-XD7-Broker`, `TA-XD7-VDA`), Splunk Add-on for Microsoft Windows, Splunk Add-on for Microsoft IIS (StoreFront), Citrix Monitor Service OData API scripted inputs",
      "dataSources": "uberAgent endpoint telemetry via HEC (`uberAgent:*` sourcetypes — session, logon, application, machine, browser, Citrix site metrics), Citrix Broker Service event logs (indexes: `xd`, `xd_winevents`, `xd_alerts`), VDA performance counters (`xd_perfmon`), Citrix StoreFront IIS W3C logs, Citrix Monitor Service OData API (session/logon/machine data), Citrix Licensing logs, Citrix PVS streaming logs, Citrix Profile Management logs, Citrix FAS certificate events",
      "guide": "docs/guides/citrix-virtual-apps-desktops.md"
    },
    {
      "id": "2.7",
      "name": "2.7",
      "useCaseCount": 7
    },
    {
      "id": "2.8",
      "name": "2.8",
      "useCaseCount": 14
    },
    {
      "id": "2.9",
      "name": "2.9",
      "useCaseCount": 14
    },
    {
      "id": "2.10",
      "name": "2.10",
      "useCaseCount": 13
    }
  ],
  "useCaseCount": 224
}
